{
  "record_id": "sub-abc123def456",
  "schema_family": "subscription_record",
  "owner_id": "owner-xyz789",
  "stripe_customer_id": "cus_QwErTy123456",
  "stripe_subscription_id": "sub_AsDfGh789012",
  "tier": "elder",
  "status": "active",
  "usage": {
    "kin_count": 2,
    "kin_limit": 3,
    "api_calls_current": 45230,
    "api_calls_limit": -1,
    "storage_used_mb": 2048,
    "storage_limit_mb": 10000,
    "voice_minutes_current": 45.2,
    "voice_minutes_limit": -1
  },
  "billing_cycle": {
    "interval": "month",
    "current_period_start": "2026-03-01T00:00:00Z",
    "current_period_end": "2026-04-01T00:00:00Z",
    "amount": 19400,
    "currency": "usd"
  },
  "renewal_date": "2026-04-01T00:00:00Z",
  "trial_end": null,
  "cancel_at_period_end": false,
  "canceled_at": null,
  "payment_method": {
    "type": "card",
    "last_four": "4242",
    "brand": "visa",
    "expiry_month": 12,
    "expiry_year": 2027
  },
  "features": {
    "voice_mode": true,
    "custom_specializations": true,
    "priority_support": true,
    "api_access": true,
    "drift_alerts": true,
    "health_monitoring": true
  },
  "created_at": "2025-06-15T10:30:00Z",
  "updated_at": "2026-03-20T14:22:00Z"
}
